{
  "id": "data-patches",
  "version": "0.1.0",
  "game": "btn",
  "data": [
    {
      "target": { "symbol": "gMessageWindowHandlers" },
      "offset": 12,
      "type": "fnptr",
      "value": { "file": "src/open.c", "function": "logged_open" }
    },
    {
      "target": { "symbol": "gOvl27SpriteFrameIds0" },
      "offset": 0,
      "type": "u16",
      "value": 64
    }
  ]
}
